Keyword,Intencion,Volumen Mensual Estimado,Dificultad (1-100),Relevancia GUPRI (1-10),Prioridad,Notas
seguridad privada para condominios,Transaccional,1800,55,10,ALTA,"Keyword principal. Alta competencia pero volumen excelente. Foco absoluto."
guardias residenciales,Transaccional,1400,48,10,ALTA,"Segunda keyword principal. Menor competencia que condominios."
empresa de seguridad privada mexico,Transaccional,2200,68,9,ALTA,"Volumen alto pero competencia fuerte de grandes players."
guardias de seguridad para condominios,Transaccional,1200,45,10,ALTA,"Long-tail de alta conversion. Menos competencia."
seguridad privada condominios cdmx,Transaccional Local,900,42,10,ALTA,"Geolocalizacion CDMX. Excelente para Local Pack."
vigilancia para fraccionamientos,Transaccional,700,38,9,ALTA,"Variacion semantica con buen volumen."
seguridad residencial mexico,Transaccional,1100,52,9,ALTA,"Termino amplio pero relevante."
guardias intramuros condominios,Transaccional,600,35,10,ALTA,"Termino tecnico con alta intencion de compra."
cotizar seguridad privada condominios,Transaccional,350,28,10,ALTA,"Intencion de compra muy alta. Conversion directa."
precio guardias seguridad condominios,Transaccional,450,32,10,ALTA,"Usuarios en fase de decision. Alta conversion."
cuanto cuesta seguridad privada condominio,Informativa/Transaccional,500,30,10,ALTA,"Pregunta directa. Oportunidad featured snippet."
empresas de seguridad para condominios,Transaccional,800,48,10,ALTA,"Plural indica comparacion. Usuario cerca de decidir."
vigilancia 24 horas condominios,Transaccional,400,35,9,ALTA,"Especifica necesidad. Alta relevancia."
control de acceso condominios,Transaccional/Informativa,650,40,8,MEDIA,"Servicio complementario. Oportunidad de expansion."
guardias de seguridad cdmx,Transaccional Local,1600,58,9,ALTA,"Alto volumen local. Competencia media-alta."
seguridad privada estado de mexico,Transaccional Local,700,45,8,MEDIA,"Expansion geografica natural desde CDMX."
seguridad privada guadalajara,Transaccional Local,600,42,7,MEDIA,"Mercado secundario importante."
seguridad privada monterrey,Transaccional Local,550,40,7,MEDIA,"Mercado secundario con potencial."
seguridad privada queretaro,Transaccional Local,400,35,7,MEDIA,"Crecimiento inmobiliario = demanda."
como elegir empresa seguridad condominios,Informativa,300,22,10,ALTA,"Content marketing. Posiciona como experto."
requisitos seguridad privada condominios,Informativa,250,20,9,MEDIA,"Contenido educativo. Atrae trafico organico."
ley seguridad privada mexico,Informativa,400,25,7,MEDIA,"Autoridad. Usuarios en fase de investigacion."
certificaciones seguridad privada mexico,Informativa,200,18,8,MEDIA,"Diferenciador. Genera confianza."
REPSE seguridad privada,Informativa,350,15,8,MEDIA,"Termino tecnico-legal. Trafico cualificado."
mejores empresas seguridad condominios mexico,Navegacional/Transaccional,500,55,10,ALTA,"Usuario comparando. Aparecer en listas."
seguridad privada cerca de mi,Transaccional Local,800,62,9,ALTA,"Busqueda movil. Requiere SEO local fuerte."
guardias para residenciales privados,Transaccional,450,38,10,ALTA,"Variacion long-tail muy relevante."
vigilantes para conjuntos residenciales,Transaccional,300,30,9,MEDIA,"Variacion regional (algunas zonas usan 'conjunto')."
seguridad perimetral condominios,Transaccional/Informativa,250,28,8,MEDIA,"Servicio especifico. Nicho."
rondines de seguridad condominios,Transaccional/Informativa,180,20,9,MEDIA,"Termino operativo. Usuarios informados."
seguridad privada para edificios,Transaccional,550,42,9,ALTA,"Variacion de condominios. Edificios verticales."
guardias para calles privadas,Transaccional,200,25,9,MEDIA,"Nicho especifico de fraccionamientos."
monitoreo cctv condominios,Transaccional/Informativa,350,35,7,MEDIA,"Servicio tecnologico complementario."
seguridad integral condominios,Transaccional,280,32,9,MEDIA,"Propuesta de valor diferenciada."
administracion y seguridad condominios,Informativa/Transaccional,220,28,7,BAJA,"Cross-selling con administradoras."
protocolo seguridad condominios,Informativa,300,18,8,MEDIA,"Contenido educativo. Top of funnel."
capacitacion guardias seguridad,Informativa,400,22,6,BAJA,"Relevante pero no core business directo."
sueldo guardias seguridad mexico 2025,Informativa,600,15,5,BAJA,"Alto volumen pero baja intencion comercial."
bolsa trabajo guardias seguridad,Informativa,900,20,4,BAJA,"Trafico de candidatos no clientes."
seguridad privada precios 2025,Transaccional,700,38,10,ALTA,"Actualizacion anual. Trafico caliente."
