Semana,Fecha Publicacion,Titulo,Keyword Objetivo,Volumen Estimado,Formato,Intencion,Longitud Palabras,Objetivo Conversion,CTA Principal,Notas
1,Semana 1,"Guia Completa: Como Elegir una Empresa de Seguridad Privada para tu Condominio",como elegir empresa seguridad condominios,300,Guia larga,Informativa,2500-3000,Posicionar como experto - capturar email,Descarga checklist gratuito,"Incluir checklist descargable como lead magnet. Cubrir: certificaciones, preguntas clave, red flags, proceso de evaluacion."
2,Semana 2,"Cuanto Cuesta la Seguridad Privada para Condominios en Mexico (2025)",precio seguridad privada condominios 2025,700,Articulo con tablas,Transaccional,1800-2200,Capturar trafico caliente - CTA cotizacion,Solicita tu cotizacion personalizada,"Incluir rangos de precios reales ($30k-$42k), factores que afectan costo, comparativa por tipo de servicio."
3,Semana 3,"10 Medidas de Seguridad que Todo Condominio Debe Implementar",medidas seguridad condominios,350,Listicle,Informativa,1500-1800,Awareness - lead magnet descargable,Descarga infografia completa,"Medidas fisicas, tecnologicas y operativas. Incluir infografia descargable."
4,Semana 4,"Requisitos Legales para Contratar Seguridad Privada en Mexico",requisitos seguridad privada mexico,250,Articulo informativo,Informativa,1800-2000,Autoridad - generar confianza,Verifica que tu proveedor cumpla,"Cubrir REPSE, registros SSP, multas por incumplimiento, como verificar."
5,Semana 5,"Guardia Intramuros vs Seguridad Electronica: Cual es Mejor para tu Condominio?",guardia intramuros condominios,180,Comparativa,Informativa,1600-1900,Educar - CTA asesoria,Agenda asesoria gratuita,"Pros/contras de cada opcion, cuando combinar ambas, casos de uso."
6,Semana 6,"Seguridad Privada para Condominios en CDMX: Lo que Debes Saber",seguridad privada condominios cdmx,900,Articulo localizado,Transaccional Local,2000-2400,Capturar trafico local CDMX,Cotiza para tu condominio en CDMX,"Regulaciones CDMX especificas, zonas de mayor demanda, estadisticas locales."
7,Semana 7,"Protocolo de Seguridad para Condominios: Plantilla Descargable",protocolo seguridad condominios,300,Recurso descargable,Informativa,1400-1600,Lead magnet - captura email,Descarga plantilla gratuita,"Plantilla Word/PDF editable con protocolo completo, formatos de bitacora."
8,Semana 8,"Control de Acceso en Condominios: Tecnologias y Mejores Practicas",control acceso condominios,650,Guia tecnica,Informativa,1800-2100,Cross-sell servicios tecnologicos,Conoce nuestras soluciones,"Tipos de sistemas, biometricos vs proximidad, integracion con vigilancia."
9,Semana 9,"Las 5 Preguntas que Debes Hacer Antes de Contratar Guardias para tu Residencial",contratar guardias residencial,200,Checklist,Informativa,1200-1400,Decision helper - CTA contacto,Resolvemos tus dudas,"Formato pregunta-respuesta, errores comunes al contratar."
10,Semana 10,"Seguridad en Fraccionamientos: Retos y Soluciones",vigilancia fraccionamientos,280,Articulo problema-solucion,Informativa,1600-1900,Expansion de audiencia,Solicita evaluacion gratuita,"Retos especificos: perimetro extenso, areas comunes, visitantes frecuentes."
11,Semana 11,"REPSE y Certificaciones: Como Verificar una Empresa de Seguridad Confiable",certificaciones seguridad privada mexico,200,Articulo educativo,Informativa,1500-1700,Diferenciacion - confianza,Conoce nuestras certificaciones,"Tutorial paso a paso para verificar, links a portales oficiales."
12,Semana 12,"Caso de Exito: Como [Condominio X] Redujo Incidentes un 80% con GUPRI",caso exito seguridad condominio,150,Estudio de caso,Transaccional,1200-1500,Social proof - conversion,Quiero resultados similares,"Estructura: problema, solucion, resultados medibles, testimonio."
